,Image,Labels,Analysis,BBox
90,HECO_3511.png,Excitement,"The emotion of excitement displayed by the person in the red box can be analyzed from the following aspects:

1. **The Scene:**
   - The setting appears to be a rodeo or a similar event involving live animals and cowboys, which is often thrilling and high-energy. Events like these naturally elicit excitement due to the fast-paced and unpredictable nature of the performances.

2. **The Actions and Expressions of the Person in the Red Box:**
   - The individual is raising one arm high, which is a common gesture associated with excitement and celebration. This posture suggests active engagement and enthusiasm.
   - Wearing a cowboy hat and being dressed for the event indicates participation and passion for the activity.

3. **Interactions Between People:**
   - The crowd in the background appears to be attentively watching the event, adding to the overall atmosphere of excitement. The presence of an enthusiastic audience can elevate the energy levels and emotional responses of individuals.

Combined, these elements suggest that the person in the red box is experiencing excitement due to the lively and stimulating atmosphere of the event, their physical engagement and celebratory gestures, and the collective enthusiasm of the crowd.","[508, 27, 686, 412]"
91,HECO_3381.png,Excitement,"The scene and the actions and expressions of the person in the red box can contribute to the analysis of why this person is expressing excitement.

1. **Scene:** The background is filled with banners and a festive setup, suggesting that the setting is a public event or celebration, which is often associated with excitement and joy.

2. **Actions and Expressions:** The person in the red box is surrounded by colorful party accessories (e.g., wearing a hat) and is participating in an activity (carrying a decorated pole) that seems festive. The individual's body language, such as the posture and gestures, show high energy and engagement, often indicative of excitement.

These aspects together suggest that the festive environment and their active participation are likely causing the person to feel and express excitement.","[278, 455, 547, 806]"
92,HECO_4775.png,Peace,"The person in the red box is exhibiting the emotion of peace, and several aspects of the image may contribute to this emotional expression:

1. **Scene:**
   The environment appears calm and orderly, which might contribute to the person's peaceful demeanor.

2. **Interactions between People:**
   The person in the red box is seen walking calmly with others, possibly close companions. This supportive presence can foster a sense of serenity and peace.

3. **Actions and Expressions of the Person in the Red Box:**
   The person is maintaining a composed posture and exhibits a calm facial expression, both of which indicate a peaceful state of mind. Additionally, the person's body language appears relaxed and at ease.

No overt signs of distress or conflict are evident in the image, thereby reinforcing the emotion of peace.","[19, 45, 185, 537]"
93,HECO_6008.png,Sadness,"There are several aspects from the image conveying the emotion of sadness for the person in the red box:

1. **Scene**: The environment appears to be a prison or detention facility, as suggested by the uniforms, the barred door, and the general setting's bleak, institutional appearance. Such settings often evoke negative emotions such as sadness due to their association with loss of freedom and harsh conditions.

2. **Interactions Between People**: The person in the red box is flanked by a uniformed officer, suggesting that the individual is being escorted under constraint, which can be a humiliating and demoralizing experience.

3. **Actions and Expressions of the Person in the Red Box**: The person is holding a stack of clothing and appears to have a downcast or melancholy expression, which are indicative of feeling burdened or resigned. Their slouched posture can be interpreted as a sign of sadness or defeat.

4. **General Atmosphere**: The background with discarded trash on the floor adds to the feeling of neglect and despair, contributing further to the overall sense of sadness.

These combined elements are strong indicators that the individual's emotion is sadness.","[477, 71, 812, 1051]"
94,HECO_5706.png,Happiness,"The person in the red box is expressing happiness, which can be inferred from a few aspects:

1. **Expression**: The individual's facial expression, particularly the slight smile and relaxed eyes, suggests a positive emotional state.

2. **Scene/Background**: While the actual scene is out of focus, the warm lighting and setting appear to be conducive to positive interactions, like a social event or a casual environment.

These aspects combined effectively convey the emotion of happiness.","[230, 52, 989, 820]"
95,HECO_6555.png,Happiness,"The person in the red box is exhibiting happiness, as evidenced by:

1. **Expressions of the Person**: The person is smiling widely, a common facial expression associated with happiness and joy.
2. **Scene**: The setting appears to be cheerful and bright, contributing to a positive atmosphere which can elicit happy emotions.
3. **Interactions Between People**: The person in the red box seems to be engaged in a friendly and positive interaction with the person next to them, which often results in feelings of happiness.

These aspects collectively suggest that the individual in the red box is experiencing happiness.","[242, 30, 437, 531]"
96,HECO_8986.png,Peace,"Several aspects of the image convey the emotion of peace for the person in the red box:

1. **Facial Expressions**: The person in the red box has a calm and relaxed facial expression, which often indicates a state of peace.
2. **Interaction**: The person is gently touching another individual in an affectionate manner. This close, tender interaction suggests a peaceful and loving relationship between the two.
3. **Scene**: The background is simple and uncluttered, providing a serene and calm atmosphere which contributes to the sense of peace.
4. **Body Language**: The posture and body language of both individuals are relaxed and non-aggressive, further reinforcing the peaceful interaction.

These elements collectively suggest that the individual in the red box is experiencing a peaceful emotion.","[675, 35, 1364, 1050]"
97,HECO_5302.png,Anger,"The expression of anger in the person in the red box can be inferred from the following aspects:

1. **Facial Expression**: The person's wide eyes, furrowed brows, and open mouth convey a sense of heightened emotion, which is characteristic of anger.

2. **Gestures**: The person is pointing a finger, which is often an assertive or confrontational gesture, further indicating anger.

3. **Scene**: Although the background is somewhat blurred, the person appears to be engaged in a heated discussion or argument, suggesting that the context might involve a confrontation or disagreement leading to the expression of anger. 

These combined elements -- facial expression, gestures, and the scene -- suggest that the individual is experiencing anger.","[42, 67, 656, 577]"
98,HECO_1518.png,Fear,"In analyzing the fear expressed by the person in the red box, consider the following aspects:

1. **Expressions and Actions of the Person in the Red Box**: The individual's facial expression appears tense, and he is gripping the table tightly with his hands. These signs can indicate fear.
2. **Interactions Between People**: The person sitting next to him appears to be in a more relaxed position and seems to be conversing, which might not account for the fear. Therefore, the fear might be related to the actions or thoughts of the person in the red box alone.
3. **Scene**: The setting looks like a restaurant or a meeting area, which might not inherently be fear-inducing. However, any loud or startling sounds off-camera, or even thoughts unrelated to the environment, could be causing fear.

Considering these aspects helps to understand that the fear could stem from an internal or situational stress rather than directly from the interactions in the scene.","[9, 61, 206, 462]"
99,HECO_1397.png,Peace,"The person in the red box is exhibiting the emotion labeled as ""Peace"". Here are the aspects that likely contribute to this peaceful expression:

1. **Scene**: The setting appears to be a casual, social indoor environment, perhaps a gathering or a shared space. This type of relaxed atmosphere can foster feelings of peace and calm.

2. **Interactions Between People**: The individuals in the image are engaged in conversation and appear to be comfortable and friendly with one another. Social connections and positive interactions often contribute to a sense of peace.

3. **Expressions and Actions of the Person in the Red Box**: The person in the red box has a neutral facial expression, which can be indicative of a calm emotional state. Their body language is relaxed, and they are holding a drink, which suggests they are calmly enjoying the moment.

These aspects together create a context that is conducive to the person feeling and expressing a sense of peace.","[32, 256, 366, 986]"
100,HECO_5337.png,Happiness,"The expression of happiness from the person in the red box can be attributed to several observable aspects:

1. **Actions and Expressions of the Person in the Red Box**: The individual is captured with a slight smile while having what appears to be whipped cream on their lips. This suggests that they might be enjoying a tasty treat, which can be a source of happiness.

2. **Scene**: The close-up nature of the photo, focusing on the person's face, highlights the joyful moment, further emphasizing the positive emotion through their facial expression.

These aspects combined suggest the person is experiencing a moment of enjoyment and pleasure, likely related to eating something they find delightful.","[450, 36, 1260, 846]"
101,HECO_4795.png,Peace,"The person in the red box is expressing peace, which can be analyzed through the following aspects:

1. **Facial Expression**: The person has a serene, calm expression, which suggests a state of tranquility and peace.
2. **Body Language**: Her posture is relaxed, with hands clasped gently on the table, which conveys a sense of calmness.
3. **Scene**: The environment appears to be a formal setting with others seated in front and possibly an audience in the background, indicating a setting where calm and composed behavior is appropriate.
4. **Interactions**: While others around her might be focused or attentive, there doesn't seem to be any immediate stress or pressure on her from the interactions happening in the scene.

These elements collectively depict a peaceful emotional state.","[533, 113, 684, 337]"
102,HECO_6090.png,Peace,"Analyzing the image, here are the aspects that convey the emotional information of ""peace"" for the person in the red box:

1. **Facial Expression**: The person in the red box has a calm and composed facial expression, which is indicative of a peaceful state.

2. **Interactions Between People**: The person in the red box seems to be engaging in a relaxed and seemingly pleasant interaction with another individual, contributing to a sense of peace.

3. **Scene**: The background appears serene, with soft lighting and pleasant surroundings, which can foster a sense of tranquility and peace.

These elements together suggest why the person in the red box might be experiencing and expressing the emotion of peace.
","[421, 80, 554, 293]"
103,HECO_4680.png,Peace,"The person's emotion labeled as ""Peace"" can be analyzed based on the following aspects:

1. **Scene**: The setting appears relaxed, featuring open outdoor space with greenery in the background. The presence of nature often evokes a sense of calm and tranquility, contributing to a peaceful emotion.

2. **Interactions between people**: The individuals visible in the background seem to be in a gathering or event, suggesting social harmony and a peaceful atmosphere. 

3. **Actions and expressions**: The person in the red box is sitting quietly and facing away from the camera, indicating a moment of contemplation or relaxation. This posture often reflects inner peace and contentment.

These aspects together create an environment conducive to the expression of peace.","[340, 56, 715, 477]"
104,HECO_0639.png,Peace,"The emotion of peace expressed by the person in the red box can be inferred from several aspects of the image:

1. **Scene**: The scene appears to be a cozy indoor setting with a warm and homely atmosphere. The presence of a lit candle and soft lighting contributes to a peaceful and serene environment.

2. **Interactions Between People**: The person in the red box is in the company of others who are engaged in relaxed and pleasant conversation. The woman to their right is smiling and seems to be in a joyful interaction, suggesting a positive and peaceful social context.

3. **Actions and Expressions**: The person in the red box has a calm demeanor, with their hand resting gently on their cheek. Their facial expression is neutral and relaxed, indicating a state of ease and tranquility.

These aspects collectively convey an environment and social interaction that foster a peaceful emotion in the person within the red box.","[282, 233, 446, 434]"
105,HECO_2608.png,Happiness,"The emotion of happiness in the person in the red box can be inferred from several aspects:

1. **Actions and Expressions of the Person in the Red Box**: The person in the red box is smiling broadly with their mouth open, which is a clear indicator of happiness. Additionally, they have their hand placed gracefully on their cheek, suggesting a joyous or delighted reaction.

2. **Scene**: The person is wearing a bright pink dress adorned with a flower, and a hair accessory that matches. Bright and colorful attire is often associated with festive occasions or moments of joy.

These aspects combined strongly convey a feeling of happiness in the individual.","[190, 50, 489, 700]"
106,HECO_5330.png,Disgust,"The primary aspect conveying emotional information here is the facial expression of the person in the red box. Specific observations include:

1. **Facial Expressions**: The person's eyes are widened, eyebrows are drawn together, and the mouth is slightly open, suggesting a reaction of disgust.
2. **Scene**: The blue lighting and setting seem to indicate a potentially stressful or intense atmosphere, which might also contribute to a feeling of discomfort or disgust.

These elements together likely contribute to the person's expression of disgust in the image.","[76, 0, 600, 523]"
107,HECO_1752.png,Peace,"To analyze why the person in the red box is expressing the emotion of ""peace,"" consider the following aspects:

1. **Actions and Expressions of the Person in the Red Box**: 
   - The person has their eyes closed or partially closed, which often indicates a relaxed or meditative state.
   - They are resting their head on their hand, which can be a sign of contemplation or contentment.
   - Their facial expression is calm and serene, lacking tension or stress.

2. **Scene**:
   - The background environment appears organized and quiet, devoid of chaos or clutter, which contributes to a peaceful ambiance.

These observations suggest that the individual's demeanor and the tranquil setting around them likely contribute to their expression of peace.","[292, 110, 530, 468]"
108,HECO_0142.png,Peace,"The person in the red box is expressing an emotion labeled as ""Peace."" Analyzing the following aspects provides insight into why this particular emotion is conveyed:

1. **Scene**: The person is situated in a cozy, indoor setting, reclining comfortably on a couch. This relaxed environment contributes significantly to a sense of peace.

2. **Actions and Expressions of the Person**: The person's body language is very relaxed, with legs up on the couch and a calm, serene expression on their face. The general posture appears free from tension, suggesting a state of ease and tranquility.

Taken together, the combination of a comfortable setting and a relaxed posture naturally conveys a state of peace.","[89, 157, 849, 540]"
109,HECO_9271.png,Disgust,"The emotion of disgust displayed by the person in the red box could be attributed to several aspects observable in the image:

1. **Scene**: The setting appears to be an outdoor area that may be unclean or cluttered, which can evoke a sense of disgust. The surroundings seem to be run-down, with debris and possibly unpleasant sights.

2. **Interactions Between People**: The body language and facial expressions of the individuals around the person in the red box suggest that there is a tense or uncomfortable situation occurring. The older man beside him has his head down and looks withdrawn, while the others are watching seemingly intensely. This group dynamic might contribute to feelings of discomfort or disgust.

3. **Actions and Expressions of the Person in the Red Box**: The person's expression (as indicated by the emotion label) suggests disgust, which could be a reflection of physical sensations (smells, sights), or reactions to what others are saying or doing. His body language and interaction with the people around him might also contribute, as they all seem to be focusing on something of concern.

In summary, it is likely that a combination of the unclean setting, the tense group interactions, and whatever specific stimulus they are reacting to, all contribute to the expression of disgust by the person in the red box.","[478, 132, 755, 486]"
110,HECO_7716.png,Peace,"The emotion of ""Peace"" for the person in the red box appears to be conveyed through several aspects:

1. **Interactions between people**: The scene shows two individuals sitting and conversing in what appears to be a calm and respectful manner. The person in the red box is listening attentively, and his body language suggests openness and relaxation, indicating peaceful interaction.

2. **Actions and expressions**: The person in the red box has a neutral and slightly forward-leaning posture, indicating engagement and calm attentiveness. There is no visible tension in his body, and his facial expression is composed and relaxed.

3. **Scene**: The setting appears to be a formal or professional environment, likely an office or meeting space, which is orderly and calm. This kind of environment often promotes peaceful and composed behavior.

These combined elements suggest that the person in the red box is experiencing a state of peace, likely due to the calm and respectful nature of the conversation and the serene environment.","[84, 119, 439, 539]"
111,HECO_9381.png,Sadness,"The person in the red box is likely expressing sadness. Several aspects convey this emotion:

1. **Facial Expression:** The person's facial expression appears subdued, with slightly downturned eyes and lips, indicating sadness or distress.
2. **Scene:** The background shows a possibly cheerful environment like a cafe or bakery, which contrasts with the person's emotional state, potentially highlighting the disparity and emphasizing their sadness.
3. **Interactions Between People:** There are two people in the background engaged in conversation or an activity, seemingly unaware or unconcerned about the person in the foreground. This disconnection might contribute to feelings of isolation or loneliness for the person in the red box.

These elements together suggest the person might be feeling sad due to a sense of disconnection or isolation despite being in a lively environment.","[675, 17, 1223, 646]"
112,HECO_3707.png,Happiness,"The person in the red box is labeled as expressing happiness. The following aspects convey this emotion:

1. **Expressions and Actions**: The person is smiling broadly, which is a primary indicator of happiness.
2. **Scene**: The setting appears to be a social or formal event, possibly a celebration or gathering, which can naturally elicit positive emotions.
3. **Interactions Between People**: The person in the red box seems engaged with those around them, suggesting they are enjoying the company and the event itself. 

These elements collectively help in understanding why the person might be feeling and expressing happiness.","[172, 77, 316, 295]"
113,HECO_8651.png,Peace,"The person in the red box is expressing the emotion ""peace."" The following aspects can explain why:

1. **Interaction Between People**: The surrounding individuals seem to be smiling and in a positive, relaxed demeanor. This can contribute to an atmosphere of calmness and tranquility for everyone involved, including the person in the red box.

2. **Actions and Expressions of the Person in the Red Box**: The person in the red box is smiling softly and standing in a relaxed posture. Smiling indicates a positive and peaceful state of mind. Additionally, their relaxed posture suggests they are comfortable and at ease.

These aspects collectively convey a sense of peace for the person in the red box.","[110, 55, 261, 297]"
114,HECO_4304.png,Fear,"The individual in the red box is likely expressing fear due to several observable aspects:

1. **Scene**: The industrial, dimly lit setting with closed doors conveys a sense of entrapment and unease, which can induce fear.

2. **Interactions Between People**: Everyone in the scene is looking in the same direction, suggesting a common source of concern or threat. This collective focus implies that whatever they are observing is alarming.

3. **Actions and Expressions**: The person's body language is tense, and their expression appears wide-eyed and alert, which are typical indicators of fear. These physical cues suggest they are reacting to something unexpected and potentially dangerous. 

These elements combined convey an atmosphere of fear and tension.","[344, 250, 508, 774]"
115,HECO_8086.png,Peace,"The emotion of peace expressed by the person in the red box can be analyzed from the following aspects:

1. **Scene**: The person is in a natural outdoor setting, likely a garden or park, which is often associated with tranquility and calmness. 
2. **Interactions between people**: There is no visible interaction with other people, suggesting a peaceful, solitary moment.
3. **Actions and expressions of the person in the red box**: The person's relaxed posture, with one hand resting on their knee and the other near their chest, as well as their calm facial expression, contribute to the impression of peace.

The combination of the serene environment and the individual's composed demeanor conveys a sense of peace.","[97, 201, 1076, 1465]"
116,HECO_4095.png,Peace,"1. **Expressions and Actions of the Person in the Red Box**: The person appears calm and composed, which aligns with the emotion of peace. Their facial expression is relaxed, contributing to a peaceful demeanor.

2. **Scene**: The background is a serene outdoor setting with greenery, which often evokes feelings of peace and tranquility.

3. **Interactions Between People**: There is no indication of conflict or stress in the image. The social atmosphere appears to be calm and amicable, which can contribute to a peaceful feeling.","[83, 25, 234, 293]"
117,HECO_0413.png,Disgust,"The person in the red box is labeled as expressing disgust. Analyzing this emotion, the following aspects could be considered:

1. **Actions and Expressions of the Person in the Red Box**:
   - The individual's facial expression, while not visible in detail here, is likely exhibiting signs of disgust (e.g., wrinkling the nose, raised upper lip).
   - Their body language and posture might also contribute to expressing disgust.

2. **The Scene**:
   - The setting appears to be a social gathering in what looks like a restaurant. The person in the red box could be reacting to an unpleasant taste, smell, or sight.
  
3. **Interactions Between People**:
   - The interaction dynamics at the table might be contributing factors. For instance, the person in the red box might have heard or seen something disagreeable in the context of the ongoing conversation.
   - The expression could also be a response to someone's behavior or comments that the person finds offensive or repulsive.

These aspects combined help provide a context for understanding why the person in the red box might be expressing disgust.","[2, 51, 243, 457]"
118,HECO_7536.png,Happiness,"The expression of happiness by the person in the red box can be attributed to the following aspects:

1. **Interactions between People**: The person in the red box is warmly interacting with another individual. The person in the red box appears to be actively engaging in the conversation or activity, which is often associated with positive feelings and happiness.

2. **Expressions and Actions**: The person in the red box is smiling broadly, a clear indicator of happiness. Their body language also seems relaxed and open, which further supports the expression of positive emotions.

These aspects - noticeable joyous interaction and clear facial expressions - convey the emotional state effectively.","[34, 150, 222, 423]"
