,Image,Labels,Analysis,BBox
0,HECO_7527.png,Happiness,"The person in the red box is expressing happiness, likely due to interactions between people. The individual is engaging with another person nearby, as seen by her direct eye contact and smile. She is also holding a microphone, suggesting she might be speaking or interacting verbally, which can be a source of joy. The overall setting and the presence of communication suggest a positive social interaction, contributing to her expression of happiness.","[338, 15, 516, 420]"
1,HECO_4446.png,Peace,"The person in the red box expresses the emotion ""Peace"" due to several factors visible in the image:

1. **Scene**: The setting appears to be formal, with uniformed individuals and ornate decor, suggesting a controlled and respectful environment. This kind of setting can lead to a sense of peace due to the absence of chaos and the presence of order.

2. **Interactions Between People**: The individual in the red box is engaged in a conversation with the person in front of him. The interaction seems calm and respectful, which can contribute to a feeling of peace.

3. **Expressions and Actions**: The person in the red box has a relaxed facial expression and a slight smile, indicating a state of calmness and satisfaction. His body language is open and casual, which further implies a peaceful and contented state of mind.

These combined aspects of the scene, the respectful interaction, and the calm demeanor of the person contribute to the expression of peace.","[40, 111, 720, 761]"
2,HECO_2619.png,Happiness,"The person in the red box is expressing happiness, as evidenced by several aspects:

1. **Actions and Expressions**: The individual's facial expression, specifically the wide, genuine smile, shows joy. The open eyes and raised eyebrows are further indicators of a positive emotional state.

2. **Scene**: The neutral background keeps the focus on the individual, highlighting their expression without distractions.

These elements together suggest the person is experiencing happiness.","[83, 165, 789, 1280]"
3,HECO_0384.png,Peace,"Based on the provided image and the emotion label of ""Peace"" for the person in the red box, here are selected aspects that convey emotional information:

1. **Scene**: The setting appears to be an outdoor event or market under a tent with bright and open surroundings. The green grass, trees, and relaxed atmosphere contribute to a peaceful environment.

2. **Interactions between People**: There is minimal direct interaction shown between people. The person in the red box is sitting quietly, not engaged in active conversation, suggesting a moment of tranquility and personal peace.

3. **Actions and Expressions of the Person in the Red Box**: The individual in the red box is seated and appears to be calm and relaxed. The person's posture and lack of activity imply a state of restfulness and inner peace.

These aspects together create an overall peaceful and serene scene which contributes to the person's expression of peace.","[573, 321, 692, 601]"
4,HECO_8624.png,Sadness,"The emotional expression of sadness in the person in the red box can be attributed to the following aspects:

1. **Facial Expressions and Body Language**: The person's facial expression appears somber, with a lack of smile, and a downward gaze which are typical indicators of sadness. The body posture is also slightly slouched and the eyes seem unfocused or downcast, reinforcing the emotion of sadness.

2. **Scene and Context**: The background does not provide much context as it appears to be a neutral setting. However, the formality suggested by the suit and tie implies a serious or formal event, which might also be a source of stress or sorrow, potentially contributing to the sad expression.

The combination of the serious demeanor and the direct facial indicators of sadness all contribute to the interpretation of the person's emotional state.","[3, 4, 194, 321]"
5,HECO_6678.png,Peace,"The person in the red box is likely expressing the emotion of peace due to several aspects of the scene:

1. **Scene**: The setting appears to be a serene, natural environment with lush greenery and soft lighting, which can contribute to feelings of calm and tranquility.

2. **Actions and Expressions**: The person's body language is relaxed; they are seated with an upright posture, suggesting comfort and ease. Their facial expression appears calm, further indicating a state of peace.

3. **Interaction with the Environment**: The individual is engaged in painting, an activity often associated with relaxation and mindfulness, which can enhance feelings of peace.

These elements together create an atmosphere that promotes and reflects the emotion of peace.","[510, 231, 706, 612]"
6,HECO_5190.png,Fear,"The person in the red box is expressing fear, which can be inferred from the following aspects:

1. **Body Language and Expression**: The individual is leaning forward with raised arms and an intense stare, which are common physical reactions to fear or threat. The posture suggests defensiveness, indicating preparedness to either protect oneself or react to danger.

2. **Scene Context**: While the background is somewhat blurred, it appears that the person is in a crowded area with others around. This environment could be inducing stress or fear, possibly due to the close proximity to others or a specific event happening in the scene.

These aspects collectively convey the emotional state of fear in the individual.","[29, 61, 605, 500]"
7,HECO_5242.png,Happiness,"**Analyzing the Emotion: Happiness**

1. **Expressions and Actions of the Person in the Red Box:**
   - The person is smiling, which is a common expression of happiness and joy.

2. **Scene:**
   - The background appears to be colorful, potentially indicating a joyful or celebratory environment. 

These aspects combined suggest why the individual in the red box may be expressing happiness.","[109, 61, 435, 612]"
8,HECO_1688.png,Anger,"The person in the red box is expressing anger likely due to the interaction between people in the scene. Analyzing the context:

1. **Hand Gestures and Facial Expressions**: The person in the red box has a visible scowl, furrowed brows, and clenched jaw, all of which are typical indicators of anger. Additionally, the hand gesture from the person on the right, who appears to be aggressively pointing towards or barely touching the person in the red box, could be escalating the situation.

2. **Social Setting and Conflict**: The setting appears to be casual and social, likely involving alcohol, as indicated by the wine bottle and glasses. Such environments can sometimes lead to heated discussions or conflicts. The other people's expressions, particularly the man holding the wine bottle, who seems more neutral or perhaps trying to stay out of the conflict, further suggest a disagreement or confrontation may have arisen.

In summary, the anger expressed by the person in the red box is likely due to a conflict or disagreement occurring within this social setting, accentuated by aggressive hand gestures and tense facial expressions.","[484, 188, 640, 448]"
9,HECO_3140.png,Peace,"1. **Interactions between People**: The person in the red box is surrounded by others who are smiling and appear to be enjoying themselves. This convivial atmosphere contributes to a sense of peace.

2. **The Person's Actions and Expressions**: The person in the red box is holding a beverage and has a relaxed posture, which suggests they are comfortable and at ease.

3. **Scene**: The setting appears to be a casual, social environment (likely a bar), which is conducive to relaxation and enjoyment, fostering a peaceful sentiment.","[200, 206, 425, 747]"
10,HECO_1187.png,Happiness,"The person in the red box is expressing happiness, as indicated by the following aspects:

1. **The Actions and Expressions of the Person in the Red Box**: The person is visibly smiling, which is a common indicator of happiness.
   
2. **Interactions Between People**: The individual in the red box is standing close to another person who is also smiling, suggesting a positive and friendly interaction.

3. **The Scene**: The outdoor setting with greenery and a clear sky may contribute to a pleasant atmosphere, enhancing the individual's mood and making them feel happy.

These elements combined suggest that the situation and interactions are contributing to the person's expression of happiness.","[62, 20, 261, 365]"
11,HECO_4382.png,Peace,"The emotion ""Peace"" expressed by the person in the red box can be attributed to several aspects in the image:

1. **Scene**: The person is outdoors in a serene environment with greenery, trees, and what appears to be the sea or a lake in the background. Such natural settings can evoke feelings of peace and tranquility.

2. **Interactions Between People**: While there isn't a visible interaction occurring at the moment, the presence of family or friends around the individual can contribute to a sense of peace and contentment.

3. **Expressions of the Person in the Red Box**: The person has a calm and composed facial expression, which aligns with the emotion of peace. There are no signs of distress or agitation in their expression.

These aspects collectively provide a context that supports the labeling of the emotion as peace.","[146, 105, 820, 1010]"
12,HECO_1310.png,Happiness,"The person in the red box appears to be expressing happiness, which can be analyzed from the following aspects:

- **Expressions**: The person is smiling, a common indicator of happiness.
- **Interactions between people**: Though not directly interacting with another person in the frame, the presence of others nearby suggests a social setting which often contributes to positive emotions.
- **The Scene**: The setting appears casual and relaxed, indicated by the person's attire and posture, potentially contributing to a feeling of comfort and happiness.

These aspects together convey an overall sense of happiness.","[75, 53, 370, 474]"
13,HECO_5642.png,Happiness,"The person in the red box is expressing happiness, indicated by their wide smile and relaxed body posture. The actions and expressions of the person are clearly the main aspect conveying this emotion. They appear to be laughing or in a moment of joy, with an open mouth and eyes that suggest merriment. The scene itself, with the presence of boxes and a somewhat casual setting, suggests this might be a moment of relief or enjoyment after completing an activity, possibly unpacking or moving, which can be a happy and exciting experience. No other interactions with other people are visible that would contribute to the analysis of their happiness.","[149, 12, 848, 594]"
14,HECO_0357.png,Peace,"### Analysis of the Emotion ""Peace""

**1. Actions and Expressions of the Person in the Red Box:**
- **Facial Expression:** The person has a gentle and calm facial expression, which is indicative of a peaceful state of mind. There are no signs of tension, anger, or distress.
- **Posture and Gesture:** The relaxed and somewhat elegant posture, combined with the gesture of holding a teacup, suggests a serene and tranquil demeanor.

**2. The Scene:**
- **Setting:** The background appears to be a public space or an event, which might contribute to the person's sense of calm and enjoyment if they are comfortably engaging in a pleasant activity.

**Conclusion:**
The primary indicators of the person's peaceful emotion are their calm facial expression, relaxed posture, and elegant gesture of holding a teacup. These elements collectively convey a sense of serenity and tranquility.","[132, 208, 997, 827]"
15,HECO_2005.png,Peace,"The person in the red box is expressing the emotion of peace, which can be inferred from the following aspects:

**Expressions of the person in the red box:**
- **Facial Expression:** The person has a calm demeanor with closed lips forming a subtle pout, indicating relaxation and serenity.
- **Body Language:** The person's relaxed posture, with a gentle hold on the skateboard, suggests a state of ease and tranquility.

These aspects combined portray an overall sense of calmness and contentment, aligning with the emotion label of peace.","[38, 149, 1101, 845]"
16,HECO_3761.png,Disgust,"Based on the given image, the person in the red box appears to exhibit an expression of disgust. Here are possible factors that contribute to this emotion:

1. **Facial Expressions**: The individual's facial expression, specifically the wrinkling of the nose and squinting eyes, are common indicators of disgust.
2. **Scene Context**: The surrounding environment, which includes several other individuals, may also be contributing. If there is an unpleasant smell or sight, the whole context might be inducing disgust.
3. **Interactions Between People**: Possible interactions with others around them that might be negative or off-putting, contributing to the emotion of disgust.

Combining these aspects provides a comprehensive understanding of why the individual in the red box might be feeling disgusted.","[15, 77, 146, 291]"
17,HECO_0560.png,Surprise,"The person in the red box is expressing the emotion of surprise. Analyzing the image, the following aspects convey emotional information for this analysis:

1. **Expressions of the Person in the Red Box:**
   - The wide-open eyes and slightly open mouth are common indicators of surprise.
   - The person's facial expression, including the raised eyebrows, further suggests a reaction to something unexpected or startling.

2. **Scene:**
   - The scene appears to be in an indoor setting, but there are no specific elements that directly indicate a surprising event. However, the lack of context around them might add to the uncertainty or unexpected nature of their reaction.

3. **Interactions Between People:**
   - Although there is another person in the background, it does not seem to be interacting directly with the person in the red box. This lack of interaction indicates that the source of surprise might be related to something not visible in the image or an off-camera event.

By focusing on these aspects, we can infer that the person in the red box is likely reacting to something unexpected, either related to the environment or an off-camera occurrence.","[18, 244, 394, 933]"
18,HECO_9064.png,Peace,"The person in the red box is expressing the emotion ""peace."" Several aspects that convey this emotional information include:

1. **Expression and Posture of the Person in the Red Box**:
   - The person has a relaxed facial expression, which suggests a calm and serene state of mind.
   - Their posture appears to be at ease, further emphasizing a sense of tranquility.

2. **Scene**:
   - The background appears to be a natural, leafy environment, which is often associated with peaceful and calming settings.

These aspects combined-- the relaxed expression and posture of the person in the red box, along with the serene natural setting-- convey the emotion of peace effectively.","[387, 14, 839, 670]"
19,HECO_6965.png,Disgust,"The person in the red box is expressing disgust, which can be inferred from the following aspects:

1. **Facial Expressions:**
   - The person's facial expression appears tense, with the mouth potentially pulled back in a grimace, which is a common sign of disgust.

2. **Body Language:**
   - The person's body language might be rigid or withdrawn, suggesting discomfort or aversion.

3. **Contextual Cues:**
   - The scene may involve something unpleasant or offensive. However, specific details about the scene are not provided, making it hard to determine the exact cause of disgust.

4. **Interactions Between People:**
   - The person standing next to the individual in the red box seems to be engaged in conversation. The nature of this interaction, such as the tone or topic, could be contributing to the feeling of disgust.

Without additional context, the most immediate clue comes from the person's facial expressions and body language.","[362, 48, 699, 561]"
20,HECO_9329.png,Peace,"The emotion of peace expressed by the person in the red box can be analyzed through the following aspects:

1. **Scene**:
   - The backdrop appears to be an airplane hangar or museum, creating a calm and controlled environment.
   - The setting is professional, indicating an organized, planned event likely contributing to a tranquil atmosphere.

2. **Interactions Between People**:
   - The people in the image are seated and appear to be engaged in a discussion or panel.
   - There is no visible tension or conflict among the individuals, suggesting a peaceful interaction.

3. **Actions and Expressions of the Person in the Red Box**:
   - The individual is sitting calmly with their hands rested in their lap, suggesting a relaxed and composed demeanor.
   - The person's facial expression is neutral, aligning with a peaceful state of mind.

Overall, the professional setting and the composed demeanor of the participants, including the person in the red box, contribute to expressing the emotion of peace.","[984, 655, 1201, 1155]"
21,HECO_3221.png,Fear,"In analyzing the image, the following aspects contribute to why the person in the red box is expressing fear:

1. **Interactions between people**: The person standing next to the one in the red box is leaning towards them with a stern or intense expression, which might be perceived as aggressive or threatening.
   
2. **Actions and expressions of the person in the red box**: The individual in the red box is seated, with their body turned away slightly and an expression that conveys fear or discomfort. This body language suggests they may feel threatened or uneasy about the interaction with the standing person.

These factors together indicate that the dynamics of the interaction are likely causing the emotion of fear in the person in the red box.","[368, 140, 507, 387]"
22,HECO_2140.png,Happiness,"The emotion of happiness expressed by the person in the red box can be inferred from multiple aspects of the scene:

1. **Interaction between people**: The person in the red box is receiving a kiss on their lips, which is often an intimate and affectionate gesture. This interaction likely contributes to feelings of joy and affection.

2. **Expression and Body Language**: The individual in the red box has a relaxed and slightly smiling facial expression, which is a common non-verbal indicator of happiness. Their body language is open and relaxed, further suggesting comfort and contentment.

These aspects together indicate a positive and affectionate interaction contributing to the individual's expression of happiness.","[369, 251, 683, 684]"
23,HECO_7477.png,Peace,"The person in the red box is expressing the emotion labeled as ""Peace"" due to several aspects observable in the image:

1. **Scene**: The environment appears to be a public, possibly festive or recreational outdoor setting with people gathered, which can contribute to a sense of serenity and relaxation.
 
2. **Interactions between people**: The person in the red box seems to be calmly observing or engaging with others nearby, without any signs of distress or conflict. The presence of other relaxed individuals suggests a peaceful social atmosphere.

3. **Actions and expressions of the person in the red box**: The person's posture and facial expression appear relaxed and content, aligning with the emotion of peace.

Together, these aspects depict a tranquil scenario likely contributing to the person's peaceful state.","[853, 303, 907, 456]"
24,HECO_3014.png,Fear,"The person in the red box is expressing fear, which can be inferred from the following aspects:

1. **Interactions between people**: The person in the yellow jersey seems to be in close proximity and might be in an aggressive or confrontational stance. This interaction can cause a sense of fear.

2. **Actions and expressions of the person in the red box**: The person in the red box appears to have a somewhat defensive posture, possibly trying to protect themselves or anticipating a physical impact. This aligns with an expression of fear.

From these observations, the fear emotion is likely due to the immediate interactions and perceived threat from the opponent in the yellow jersey.","[135, 99, 385, 590]"
25,HECO_2653.png,Sadness,"The analysis for why the person in the red box is expressing sadness based on the emotional label and the visual cues in the image can be drawn from the following aspects:

1. **Scene**: The person in the red box is sitting alone on a couch in what appears to be a living room or a similar indoor setting. The ambience, lighting, and environment seem calm, but the solitary setting could contribute to a feeling of loneliness or sadness.

2. **Interactions Between People**: There are two people visible in the image, but there is no visible interaction between the person in the red box and the other person. The lack of interaction could suggest isolation or disconnection, which might be contributing to the person's sadness.

3. **Actions and Expressions**: The person in the red box is not smiling and appears to be looking down or away, which often signifies sadness or introspection. Their posture is somewhat closed and passive, reinforcing a sense of melancholy or resignation.

By focusing on these aspects, it is evident that the person labeled as experiencing sadness is likely influenced by a lack of social interaction or connection, as well as their own introspective or reflective state in a subdued environment.","[123, 64, 777, 565]"
26,HECO_1199.png,Happiness,"The person in the red box is expressing happiness. Several aspects from the image support this observation:

1. **Expressions of the Person in the Red Box**: The individual is smiling, which is a clear indicator of happiness. The smile suggests they are experiencing positive emotions.

2. **Interactions Between People**: The presence of another person in close proximity with a similar happy expression suggests a positive interaction between them. This social connection often enhances feelings of joy and happiness.

3. **The Scene**: The background and overall setting appear casual and relaxed, which can create a comfortable and happy atmosphere for the people in the scene.

These elements collectively suggest that the individual in the red box is happy due to a pleasant interaction and a comfortable environment.","[18, 117, 255, 619]"
27,HECO_0243.png,Happiness,"The person in the red box is expressing happiness, which can be deduced from the following aspects:

1. **Scene**: The setting appears to be a public event or parade focused on cycling. Such events are typically joyous and celebratory, which can induce feelings of happiness.
   
2. **Interactions Between People**: The presence of other smiling and relaxed individuals around the person indicates a fun and communal atmosphere, which can enhance the person's feelings of happiness.

3. **Actions and Expressions of the Person in the Red Box**: The person is actively participating in the event, riding a bicycle while dressed in a playful and festive outfit. This engagement in an enjoyable activity can contribute significantly to their happy expression.

These aspects together suggest that the person's happiness is a result of participating in a lively, social, and enjoyable event.","[514, 94, 710, 538]"
28,HECO_0953.png,Peace,"The person in the red box is expressing the emotion of ""peace,"" which can be deduced from the following aspects:

1. **Actions and Expressions**: The individual in the red box is making a peace sign with their hand, a universal gesture associated with peace and calmness. Additionally, the person's demeanor appears relaxed, and they have a slight smile, which contributes to their peaceful expression.

2. **Scene**: The background features a school or campus setting with clear skies and palm trees, which creates an overall serene and pleasant environment. This tranquil setting can contribute to the person's peaceful mood.

3. **Interactions Between People**: The person in the red box is among friends or peers, which is indicated by the close physical proximity and casual postures. Being in a comfortable and supportive social setting can evoke feelings of peace and contentment.

These elements combined suggest that the individual in the red box is experiencing and expressing a sense of peace.","[236, 264, 374, 617]"
29,HECO_3659.png,Disgust,"The person in the red box is expressing disgust. Key aspects to analyze include:

1. **Actions and Expressions of the Person in the Red Box**: 
   - The facial expression of the person, especially the tightened lips and partially closed eyes, often signifies disgust.
   - Their body language, such as the positioning of their hands and how they are leaning away slightly, also indicates discomfort or aversion.

2. **Interactions Between People**:
   - Observe how the person in the red box is engaging with others. They might be reacting to something someone said or did, leading to their expression of disgust.
   - The proximity of the person in the red box to other individuals and their possible reaction to a specific individual or the group could provide clues.

3. **The Scene**:
   - The context of the environment might also be a factor. If there's something in the surrounding that is unpleasant or offensive to the person in the red box, this could trigger the emotion of disgust.

By focusing on these elements, we can infer the person in the red box is likely responding negatively to an immediate stimulus or interaction within the context of this environment.","[6, 70, 143, 297]"
