,Image,Labels,Analysis,BBox
298,HECO_1027.png,Peace,"The person in the red box is expressing ""peace,"" which can be analyzed based on the following aspects:

1. **Scene**: The setting appears to be a calm, professional environment, possibly a talk show or interview. The orderly setting and controlled lighting suggest a scenario designed for thoughtful conversation, which can contribute to a peaceful demeanor.

2. **Actions and Expressions**: The person's relaxed posture, slight smile, and open body language convey a sense of calm and tranquility. They appear to be comfortable and engaged in the conversation, without signs of tension or stress.

3. **Interactions Between People**: The interaction between the individuals seems respectful and composed. The person in the red box is making eye contact with the other individual, indicating active listening and calm engagement. This mutual respect and positive interaction likely contribute to the peaceful expression. 

These aspects collectively suggest that the person's peaceful emotion is influenced by the calm and professional scene, relaxed body language, and positive interaction in the conversation.","[633, 95, 969, 537]"
299,HECO_4357.png,Fear,"Analyzing the provided image, several aspects indicate the emotion of fear being experienced by the person in the red box:

1. **Scene**: The setting appears militaristic with uniforms and helmets, suggesting a war or military conflict scenario, which is inherently stressful and frightening.

2. **Interactions Between People**: The individuals around the person in the red box have their hands raised, a common gesture associated with surrender or compliance in a tense, potentially life-threatening situation. This interaction indicates a high-stress environment which can induce fear.

3. **Actions and Expressions of the Person in the Red Box**: While the expression is not distinctly visible, the person's body language--standing still and maintaining a neutral posture amidst others raising their hands--could imply apprehension or fear.

These factors collectively suggest that the person is expressing fear due to the high-stress military situation, interactions indicating surrender or compliance, and the tension observable in their body language and the scene context.","[32, 201, 339, 707]"
300,HECO_1203.png,Happiness,"The person in the red box is expressing happiness. This emotion can be analyzed through several aspects:

1. **Scene**: The scene appears festive and social, with several people gathered together in what looks like a celebratory setting.
2. **Interactions Between People**: The group is tightly-knit and appears engaged with one another, suggesting positive social interactions.
3. **Actions and Expressions of the Person in the Red Box**: The person in the red box is smiling, which is a clear indicator of happiness. 

These aspects collectively contribute to the understanding that the person in the red box is experiencing happiness.","[321, 113, 388, 363]"
301,HECO_4595.png,Excitement,"The image shows three individuals, with the person in the red box labeled as expressing excitement. Here are the aspects that convey the emotional information:

1. **Interactions Between People**:
   - The person in the red box appears to be engaged in an enthusiastic interaction with the person on the left, who is smiling and seems to be energetically reaching out to the person in the red box. This interaction suggests a shared moment of joy or celebration, contributing to the person's excitement.

2. **Actions and Expressions of the Person in the Red Box**:
   - The person in the red box is showing a forward movement, possibly gesturing or reaching out excitedly, which implies they are active and engaged in the moment. There is a visible intensity in their posture that aligns with feelings of excitement.

The excited emotion can be attributed to these dynamic and positive social interactions coupled with expressive body language.","[1065, 119, 1511, 773]"
302,HECO_6163.png,Peace,"The person in the red box is expressing the emotion of peace. This can be inferred from the following aspects:

1. **Body Language and Expression**:
   - The person in the red box has a relaxed posture, which is often associated with a sense of calm and tranquility.
   - Their facial expression appears neutral and serene, lacking signs of tension or distress.

2. **Scene**:
   - The environment seems calm and orderly, which can contribute to a peaceful state of mind.

3. **Interactions between People**:
   - Another individual has their arm gently placed on the shoulder of the person in the red box, indicating a comforting or supportive gesture which can foster feelings of peace.

These aspects collectively suggest that the person is experiencing a peaceful emotion.","[52, 40, 183, 289]"
303,HECO_3228.png,Peace,"The person in the red box appears to express the emotion ""peace"" due to several aspects:

1. **Actions and Expressions**:
   - The individual has a calm and composed facial expression. There is no visible tension or stress, which often signifies a state of tranquility.
   
2. **Scene**:
   - The person is seated in a comfortable setting, likely a living room, which commonly represents a space for relaxation.
   
3. **Interactions**:
   - While there is another person present, the individual in the red box does not seem to be engaged in any conflict or heated interaction, suggesting a peaceful coexistence.

These elements combine to convey a sense of peace.","[43, 7, 468, 716]"
304,HECO_6213.png,Peace,"The person in the red box is expressing an emotion of peace. This analysis is based on the following aspects:

1. **Expressions and Posture**:
   - The person in the red box has a calm and composed facial expression, with no signs of tension or distress.
   - Their posture appears relaxed, suggesting a state of tranquility.

These factors provide the basis for interpreting the emotion as peace. The scene does not show any chaotic or stressful elements, and the individual's demeanor is serene and undisturbed.","[740, 51, 1176, 770]"
305,HECO_0297.png,Peace,"The person in the red box is expressing peace, which can be inferred from several aspects:

1. **Scene**: The setting appears to be a calm, indoor environment, perhaps at a social gathering or meeting. There are no visible signs of chaos or distress, which suggests a peaceful atmosphere.

2. **Interactions**: The person in the red box is sitting along with others, who also seem to be at ease. The relaxed body language and the sense of companionship contribute to the overall peaceful vibe.

3. **Actions and Expressions**: The person in the red box is sitting with a gentle posture and has a neutral to serene facial expression. The relaxed demeanor, including the slight forward lean and calm facial features, indicates a state of peace.

These aspects collectively convey an environment and interactions that would lead the person to feel at peace.","[112, 135, 651, 787]"
306,HECO_1180.png,Excitement,"Based on the image, the person in the red box is likely expressing excitement for the following reasons:

1. **Scene**: The person appears to be in a lively outdoor setting, possibly at a playground or amusement area, which is generally associated with fun and excitement.

2. **Interactions between people**: The person in the red box, along with the child they are holding, appears to be engaging in a joyful activity, such as riding a bicycle, which can be thrilling and lead to feelings of excitement.

3. **Actions and expressions of the person in the red box**: The individual's facial expression, with a wide smile, conveys a sense of enthusiasm and excitement. Additionally, their posture and engagement in the activity suggest they are having a good time.

These aspects collectively contribute to the conveyed emotion of excitement by the person in the red box.","[164, 111, 447, 477]"
307,HECO_7889.png,Happiness,"Apologies, but the indicated person in the red box is not visibly expressing happiness in this image.","[293, 99, 931, 1286]"
308,HECO_8841.png,Peace,"The person in the red box is expressing the emotion labeled as ""Peace."" Here are the aspects that contribute to this emotion:

1. **Expressions and Actions of the Person in the Red Box**: The individual has a calm and gentle facial expression, which is indicative of inner peace and contentment. There is a slight smile, which commonly reflects a serene and positive state of mind.

2. **Scene and Interactions Between People**: The background shows another person who also appears calm and engaged in conversation or listening. The overall setting seems to be relaxed and friendly, reinforcing the peaceful atmosphere.

These aspects together convey a tranquil and composed emotional state for the person in the red box.","[167, 18, 391, 300]"
309,HECO_3374.png,Sadness,"The person in the red box appears to be experiencing sadness in the given image. Here are some observations that may convey emotional information:

1. **Expressions of the Person in the Red Box**: The person in the red box has a distinct frown and downward gaze, which are common indicators of sadness.

2. **Scene and Surroundings**: It appears to be a celebratory setting, such as a birthday party, with a cake and children seemingly enjoying themselves. This contrast between the environment and the person's emotional state may contribute to the feeling of sadness. Perhaps the person feels disconnected or isolated despite the cheerful surroundings.

3. **Interactions between People**: Other individuals in the image are engaged and smiling, especially focused on the cake and each other, while the person in the red box is not interacting with them. The lack of engagement with others could highlight feelings of loneliness or exclusion.

In conclusion, the sadness of the person in the red box seems to stem from their expressions indicating unhappiness, the cheerful and possibly contrasting scene, and the lack of interaction with the other people in the image, which could be making them feel isolated or disconnected.","[524, 132, 702, 430]"
310,HECO_8581.png,Happiness,"The person in the red box is expressing happiness, likely due to several aspects conveyed in the image:

1. **Scene**: The individuals are outdoors in a pleasant, green environment, which can contribute to feelings of joy and relaxation.
2. **Interactions between People**: There are multiple people in close proximity, suggesting social interaction and possibly a friendly or familial gathering, which can evoke happiness.
3. **Actions and Expressions**: The person in the red box has a visible smile, a direct indicator of happiness. Additionally, the relaxed body posture and presence of others indicate a positive social experience.","[18, 108, 170, 410]"
311,HECO_0371.png,Peace,"The image captures a scene in what appears to be a cozy and warm indoor environment, possibly suggesting a relaxed atmosphere. Here are possible aspects contributing to the person in the red box expressing the emotion ""Peace"":

1. **The Scene**: The surrounding environment seems calm and homely, with warm lighting, shelves filled with various items, and the overall cluttered yet organized setup. This kind of setting can induce a sense of tranquility and comfort.

2. **Interactions Between People**: The person in the red box is engaged in a conversation or interaction with another individual. The body language of both people suggests they are comfortable and absorbed in what seems to be a calm and friendly discussion.

3. **Actions and Expressions of the Person in the Red Box**: The person in the red box is seated comfortably and appears relaxed. While the facial expression is not clearly visible, the posture and setup imply they are engaged in a soothing, maybe reflective or intimate moment, encouraging a peaceful state of mind.

These aspects collectively suggest an environment and interactions that foster a sense of peace for the individual in the red box.","[437, 178, 781, 673]"
312,HECO_5106.png,Peace,"The person in the red box is expressing an emotion of peace, which can be analyzed based on the scene and their actions and expressions:

1. **Scene**: The surrounding environment seems calm and serene, filled with flowers which typically evoke positive and peaceful emotions. The background appears to be blurred and softly lit, contributing to a tranquil atmosphere.

2. **Actions and expressions of the person in the red box**: The individual is gently holding a flower and appears to be calmly observing it. Handling flowers can be a peaceful and soothing activity, often associated with mindfulness and appreciation of beauty.

These aspects suggest that the calm and tranquil setting, paired with the peaceful activity of tending to flowers, contribute to the person expressing a serene and peaceful emotion.","[701, 36, 1401, 926]"
313,HECO_2769.png,Surprise,"In analyzing the image for why the person in the red box is expressing the emotion of surprise, the following aspects convey emotional information:

1. **Expression of the Person in the Red Box**: The person's wide eyes and open-mouthed smile indicate a surprised reaction. These expressions are typical signs of surprise and excitement.

2. **Scene Context**: The person is in a social setting, perhaps a restaurant or a gathering where unexpected news or events commonly occur. This setting can lead to surprising and spontaneous reactions.

These aspects together suggest that the surprise emotion is likely due to a sudden and unexpected social interaction or event within this environment.","[5, 1, 550, 668]"
314,HECO_1629.png,Happiness,"The person in the red box is expressing happiness, which can be analyzed through the following aspects:

1. **Expressions of the Person in the Red Box:**
   - The individual has a noticeable smile, which is a clear indicator of happiness.
   - The person's eyes are slightly squinted, often associated with genuine smiles and happiness.

2. **Scene and Interactions:**
   - The scene appears to be indoors, possibly in a casual or social setting.
   - The close proximity to another person suggests interaction, implying a positive social environment which can contribute to feelings of happiness.

These aspects collectively contribute to the understanding that the person in the red box is experiencing and expressing happiness.","[7, 7, 230, 462]"
315,HECO_6033.png,Happiness,"The person in the red box is expressing happiness, as evidenced by their surroundings and interactions. Here are the key aspects informing this emotional expression:

1. **Scene**: The overall environment appears to be social and likely celebratory, such as an event or gathering where people are close together and comfortable.

2. **Interactions Between People**: There is at least one more person visible, and they also seem to have pleasant expressions. The proximity and shared positive vibe suggest a friendly interaction, contributing to the happiness of the person in the red box.

3. **Expressions and Actions**: The person in the red box has a noticeable smile, which is a direct indicator of their happy emotional state. Their relaxed posture and confident demeanor further reinforce the sentiment of happiness.

These combined elements of the scene and social interactions strongly suggest a context of shared joy and positive engagement.","[260, 58, 539, 519]"
316,HECO_7254.png,Peace,"The person within the red box is labeled as expressing the emotion ""peace."" Several aspects of the image can help convey why this person might be feeling peaceful:

1. **The Scene**: The person is inside what appears to be a military tank. Despite the inherently tense and stressful environment of military settings, the peaceful expression could suggest a moment of calm amidst chaos or reassurance about their safety within the tank.

2. **Actions and Expressions**: The individual in the red box is holding something (possibly a microphone or another object) and seems focused yet calm. The lack of visible stress in their posture and face might contribute to an overall sense of peace.

These aspects contribute to interpreting the person's feeling of peace, indicating a moment of calmness and focus.","[48, 197, 367, 433]"
317,HECO_1300.png,Happiness,"The person in the red box is expressing happiness, and the following aspects convey this emotional information:

1. **Expressions and Body Language:**
   - The individual is smiling broadly, which is a clear indicator of happiness.
   - The relaxed posture and open body language further suggest a positive and happy disposition.

2. **Scene:**
   - The surrounding scene appears to be a casual and social setting, possibly a gathering or celebration, which commonly evokes happiness.
   - There is a festive or cozy atmosphere in the background, including items that suggest a comfortable environment, enhancing the mood of contentment.

3. **Interactions Between People:**
   - Although the interactions between people are not explicitly visible in the image, the positioning of individuals close to each other generally implies camaraderie and friendly interactions, contributing to the overall happy vibe.

By analyzing these aspects, it is evident why the person in the red box is expressing happiness.","[365, 55, 514, 460]"
318,HECO_6288.png,Happiness,"The expression of happiness by the person in the red box can be analyzed through the following aspects:

1. **Interactions between People**: The person in the red box appears to be in close physical contact with someone else, giving and receiving a hug. This suggests a friendly or loving interaction, which is often associated with happiness.

2. **Actions and Expressions of the Person in the Red Box**: The person in the red box is smiling broadly. Smiles are a universal indicator of happiness and positive emotions.

These aspects combined--friendly interactions and positive facial expressions--convey the individual's happiness in the moment captured by the image.","[392, 158, 591, 648]"
319,HECO_3081.png,Peace,"The person in the red box is likely expressing the emotion of peace due to several aspects:

1. **Scene**: The setting appears to be a public, outdoor space that seems relaxed and laid-back, which can contribute to a feeling of peace.
2. **Interactions Between People**: The person in the red box seems to be engaged in a calm and undisturbed interaction with others around, possibly enjoying the moment.
3. **Actions and Expressions of the Person**: The body language of the person in the red box seems relaxed, and there is no visible tension, suggesting a state of peacefulness.","[206, 365, 324, 782]"
320,HECO_9060.png,Happiness,"The person's expression of happiness in the red box can be analyzed based on the following aspects:

1. **Expressions**: The person has a smile, which is a direct indicator of happiness.
2. **Interactions Between People**: The person is engaged in eye contact with another individual, possibly suggesting a positive interaction.
3. **Scene**: The backdrop appears to be outdoors or in a casual setting, which might contribute to a relaxed and happy environment.

Overall, the combination of a smiling facial expression and seemingly positive social interaction likely contributes to the emotion of happiness.","[44, 49, 278, 666]"
321,HECO_3846.png,Peace,"The person in the red box is expressing ""peace"" due to several possible aspects:

1. **Expressions and Body Language**: The person's facial expression is calm and composed, which aligns with a feeling of peace. Their body posture is relaxed and unstrained.

2. **Scene**: The scene appears to be outdoors with a natural background, which can evoke feelings of tranquility and serenity, contributing to a peaceful emotion.

By focusing on these aspects, it is evident that the environment and the person's demeanor contribute significantly to the expression of peace.","[144, 91, 301, 326]"
322,HECO_3902.png,Happiness,"The person in the red box is expressing happiness, as indicated by the following aspects:

1. **Interactions between people**: The person in the red box is engaged in a handshake or a congratulatory gesture with another person, suggesting a positive interaction or achievement.
2. **Expressions**: The person in the red box is smiling, which is a clear indicator of happiness.
3. **Scene**: The setting appears to be social with other people nearby, possibly in a celebratory or communal environment, contributing to a cheerful atmosphere.

These combined aspects suggest that the person in the red box is experiencing happiness due to positive social interaction, facial expression, and a joyful setting.","[308, 26, 475, 325]"
323,HECO_1183.png,Peace,"The person in the red box may be expressing the emotion of peace based on the following aspects:

1. **Expressions and Body Language**: The person's serene facial expression and relaxed posture suggest a state of calmness and tranquility.
2. **Scene**: The setting appears to be comfortable and informal, possibly a home or a cozy public place, which can contribute to a peaceful environment.
3. **Interactions**: The close physical proximity and warm, happy expressions of the surrounding people imply a positive and comforting social interaction, contributing to the person's sense of peace.","[269, 147, 405, 370]"
324,HECO_0585.png,Happiness,"The person in the red box is expressing happiness, which can be inferred from the following aspects:

1. **Expressions of the Person in the Red Box**: The individual's facial expression, especially the smile, is a key indicator of happiness.

2. **Scene**: The natural, green environment in the background often contributes positively to people's moods, suggesting a pleasant setting.

3. **Interactions Between People**: The presence of other people in the background, who also appear to be in a relaxed setting, may suggest a social gathering or event that contributes to the person's happiness.

These aspects collectively indicate that the person might be experiencing a joyous moment, likely enhanced by the pleasant environment and social interactions.","[131, 114, 836, 758]"
325,HECO_5625.png,Peace,"The person in the red box appears to be expressing the emotion of peace based on the following aspects:

1. **Expressions and Actions**: The person's facial expression, characterized by a calm and relaxed demeanor without any signs of tension or distress, suggests a sense of peace. Their slightly parted lips and the gentle, neutral look in their eyes contribute to this tranquil impression.

In this analysis, the scene and interactions between people are not visibly informative in conveying emotional information. The focus is primarily on the calm and serene facial expression of the person in the red box, leading to the interpretation of peace.","[87, 65, 766, 583]"
326,HECO_8542.png,Peace,"- **Expressions of the person in the red box:** The person appears to have a calm and serene facial expression, which aligns with the emotion of peace.
- **Scene:** The environment appears to be tranquil and indoor, possibly adding to the serene atmosphere.
- **Body language:** The person's relaxed posture and composed demeanor contribute to the sense of peacefulness. 

These aspects together convey the emotion of peace effectively.","[325, 34, 474, 241]"
327,HECO_1730.png,Happiness,"The person in the red box is expressing happiness, which can be derived from the following aspects:

1. **Expressions and Actions**: The person's slight smile and relaxed posture with arms crossed indicate a state of contentment and happiness. Their eyes appear slightly closed, which often accompanies a genuine, relaxed smile. The person holding a glass also suggests they might be in a celebratory or casual social situation that fosters happiness.

2. **Scene**: The background appears green and natural, suggesting an outdoor, possibly leisure environment. Settings like outdoor gatherings often contribute to positive emotions like happiness.

3. **Body Language**: The person's body language is open and relaxed, with no signs of tension or discomfort, further suggesting they are feeling happy and at ease in the moment.

These elements together contribute to the overall expression of happiness observed in the person in the red box.","[5, 27, 523, 1011]"
328,HECO_6034.png,Peace,"The expression of peace in the person in the red box can be analyzed from the following aspects:

1. **Facial Expression and Body Language**: The person's facial expression appears calm and content. They have a slight smile, which is often associated with a peaceful state of mind. Their relaxed facial features suggest a lack of stress or tension.

2. **Interactions Between People**: Although there is another person in the scene, they do not seem to be engaging in a stressful or confrontational interaction. This neutral interaction contributes to the peaceful atmosphere.

3. **Scene**: The background appears indoors, possibly in a controlled, quiet environment, which can foster a sense of peace. No signs of chaos, noise, or disturbance are evident in the scene.

These aspects together suggest the person is in a peaceful state, reflected through their calm facial expression, relaxed body language, and the tranquil environment.","[184, 64, 422, 408]"
