,Image,Labels,Analysis,BBox
180,HECO_7652.png,Happiness,"The person in the red box is expressing happiness. Here are some aspects that convey this emotional information:

1. **Expressions and Body Language**: The person's facial expression appears to be a smile, which is a common indicator of happiness. Additionally, their relaxed and open body posture suggests they are at ease and enjoying the moment.

2. **Interactions between People**: The person in the red box is engaged in a positive interaction with another individual. They are holding hands, which is a sign of affection and positive connection, further contributing to the happiness being expressed.

3. **The Scene**: The setting looks casual and comfortable, perhaps providing a cozy and pleasant environment that may contribute to the person's happy emotions. The bright and engaging environment can have a positive impact on the person's emotional state.

Considering these aspects together helps explain why the person in the red box is expressing happiness.","[58, 184, 430, 462]"
181,HECO_8969.png,Happiness,"The person in the red box is expressing happiness for the following reasons:

1. **Actions and Expressions of the Person in the Red Box:** The person is smiling broadly, which is a universal indicator of happiness. The visible content demeanor further conveys positive emotion.

2. **Interactions Between People:** The person is engaged in a positive interaction with another individual, who appears to be handing them a wrapped gift. This exchange likely contributes to the person's sense of joy and satisfaction.

These aspects combined suggest a celebratory or special moment, causing the individual to express happiness.","[186, 63, 440, 373]"
182,HECO_5457.png,Peace,"In this image, the person in the red box is expressing the emotion ""peace."" The aspects conveying this emotional information are:

1. **Expressions and Actions of the Person in the Red Box**: The person has a calm and relaxed facial expression, which is indicative of peace. Additionally, the hands are positioned in a way that suggests comfort and relaxation.
  
2. **Scene**: The setting appears to be a serene environment with soft lighting and a cozy background, which can contribute to feelings of peace and tranquility.

These elements together suggest a moment of personal stillness and relaxation, commonly associated with the emotion of peace.","[152, 21, 551, 419]"
183,HECO_0809.png,Happiness,"The person in the red box is expressing happiness due to several observable factors:

1. **Facial Expression**: The individual has a broad smile, which is a clear indicator of happiness.
2. **Interaction**: The person appears to be in the company of others, possibly friends or family, suggesting a social context that often enhances positive emotions.
3. **Scene**: The setting seems casual and relaxed, possibly a social gathering or celebration, contributing to a joyful atmosphere.
4. **Body Language**: The relaxed and open posture further supports the expression of happiness.

These aspects collectively indicate that the person in the red box is experiencing a moment of happiness.","[33, 39, 267, 255]"
184,HECO_3483.png,Fear,"The person in the red box is expressing fear, which can be analyzed based on the scene and their actions:

1. **Scene:** The person is surrounded by balloons. Though this ordinarily appears festive, the individual's emotional response suggests an unexpected or uncomfortable context.
  
2. **Actions and Expressions of the Person in the Red Box:** 
   - The person is looking attentively over their shoulder, which can indicate vigilance or alarm.
   - Their body language, leaning forward and tensed, suggests they might be trying to quickly move away from something that startled them or caused discomfort.

These aspects together suggest the person is reacting to an element within the scene that is causing them to feel fearful.","[200, 594, 370, 971]"
185,HECO_3695.png,Happiness,"The person in the red box is expressing happiness, likely due to the following aspects:

1. **Interactions between people**: The person in the red box is closely interacting with another individual, suggesting a social connection or positive relationship, which can naturally evoke feelings of happiness.
2. **Scene**: The background appears to be outdoors, with greenery and trees, which is often associated with a pleasant and enjoyable environment, contributing to a positive emotional state.
3. **Expressions**: The person's relaxed and positive expression, along with elements like smiling or gentle facial expression typically represent happiness.","[246, 59, 427, 290]"
186,HECO_9016.png,Happiness,"The person in the red box is expressing happiness, which can be inferred from several aspects:

1. **Interactions Between People**:
   - The person in the red box is engaged in a face-to-face interaction with another individual. They appear to be sharing a positive moment, possibly indicated by mutual smiles.

2. **Actions and Expressions of the Person in the Red Box**:
   - The person has face paint, suggesting they might be participating in a festive or celebratory event.
   - Their facial expression shows a smile, which is a clear indicator of happiness.

3. **Scene**:
   - The background, with trees and sunlight, creates a pleasant and serene atmosphere that could contribute to the individual's positive emotions.

These aspects collectively convey the person's happiness in the given image.","[454, 3, 874, 601]"
187,HECO_7789.png,Excitement,"The expression of excitement in the person in the red box can be analyzed based on the following aspects:

- **Expressions and Actions of the Person in the Red Box**: The person in the red box has a broad smile, which is a strong indicator of excitement. Additionally, the relaxed and happy body posture further suggests a positive emotional state.
- **Interactions Between People**: The close physical proximity and the affectionate gesture of the person embracing the individual in the red box indicate a positive and engaging interaction. This affectionate interaction can be a source of excitement.
- **Scene**: The setting appears to be in a natural, outdoor environment which may contribute to the enjoyment and excitement due to the pleasant surroundings and potential activities that could be taking place.

These aspects collectively convey the emotion of excitement of the person in the red box.","[46, 51, 403, 640]"
188,HECO_0517.png,Happiness,"Based on the image and the emotion label (Happiness) for the person in the red box, the following aspects likely convey the emotion:

1. **Expressions and Gestures**: The person in the red box has a smile on their face, which is a direct indicator of happiness. The relaxed posture, with their arms resting comfortably, further reinforces this positive emotional state.

2. **Scene**: The setting appears to be a pleasant, outdoor area with a bright and colorful environment. Such settings often contribute to a positive mood and can enhance feelings of happiness.

These aspects together suggest that the person in the red box is expressing happiness due to the combination of their positive facial expression and the cheerful setting.","[0, 6, 199, 327]"
189,HECO_1129.png,Peace,"The person in the red box appears to be expressing peace, and several aspects of the image can provide context for this emotion:

1. **Expressions and Body Language**: The person has a relaxed demeanor, indicated by a gentle smile and no signs of agitation or discomfort. The posture is calm, further suggesting a peaceful state.

2. **Interactions with Other People**: The person is engaged in a seemingly pleasant conversation with another person at the table, suggesting a positive social interaction that can evoke feelings of peace.

3. **Scene and Setting**: The setting appears to be a comfortable dining environment, which can contribute to a sense of peace. The presence of food and drink suggests a social gathering, potentially reinforcing feelings of comfort and contentment.

These combined elements--the relaxed body language, pleasant interaction, and the comfortable setting--all suggest that the individual is experiencing a peaceful moment.","[71, 95, 425, 491]"
190,HECO_3318.png,Excitement,"The person in the red box is likely expressing excitement due to the following aspects:

1. **Scene**: The setting appears to be a tennis court, with the individual holding a tennis racket and dressed in sports attire, which aligns with a competitive sports environment.
 
2. **Actions and Expressions**: The person in the red box is in the midst of a tennis swing, suggesting active participation in a match. The intensity of the swing and the person's focused expression often correlate with moments of high energy and excitement typical in competitive sports scenarios.

These elements collectively suggest a context of athletic performance, where excitement is a common emotion experienced during pivotal or successful moments in the game.","[223, 149, 689, 996]"
191,HECO_9366.png,Peace,"The emotion of ""peace"" expressed by the person in the red box can be analyzed from the following aspects:

1. **Facial Expression**: The person has a calm and relaxed facial expression. Their eyes are slightly closed, and there are no signs of tension or stress on their face.
  
2. **Body Language**: The individual appears to be in a meditative posture with hands together, which is often associated with peacefulness and relaxation.

These aspects collectively convey a sense of peace and calmness in the individual in the red box.","[495, 201, 759, 796]"
192,HECO_1222.png,Happiness,"The person in the red box appears to be displaying happiness due to several factors evident in the image:

1. **Expression and Actions**: The person in the red box has a smile on their face, which is a clear indicator of happiness. The raised arm with a closed fist can also be a gesture of excitement or triumph.
   
2. **Scene**: The background shows a musical setting with a keyboard, suggesting a performance or music-related event. Such environments often evoke joy and excitement.
   
3. **Interactions with People**: There are other people in the background appearing relaxed and engaged, contributing to a positive and joyful atmosphere. The interaction among individuals appears to be pleasant and cordial. 

These aspects collectively convey that the person in the red box is experiencing happiness.","[195, 109, 310, 423]"
193,HECO_5419.png,Happiness,"The person in the red box appears to be expressing happiness. This can be inferred from the following aspects:

1. **Facial Expressions:** The person's smile, indicated by the upturned corners of their mouth, is a clear sign of happiness.

2. **Scene:** The relaxed setting, possibly within a home or comfortable environment, contributes to a feeling of ease and contentment, which can enhance feelings of happiness.

3. **Interactions and Actions:** The person is holding a TV remote control, a common activity associated with leisure and enjoyment. This suggests they might be engaging in a pleasant activity like watching a favorite show or movie, contributing to their happy expression.

These elements collectively convey the person's happiness in the situation depicted.","[206, 58, 521, 691]"
194,HECO_2012.png,Fear,"The person's expression of fear could be analyzed based on the following aspects:

1. **Interactions Between People**: The person in the red box is being physically and possibly aggressively restrained by another person's hand. This physical interaction can trigger fear, indicating a situation where the person feels threatened or in danger.

2. **Actions and Expressions of the Person in the Red Box**: The facial expression of the person in the red box, which includes raised eyebrows, widened eyes, and possibly an open mouth, are common physiological responses associated with fear. This expression suggests the person feels scared or alarmed.

These elements together suggest that the emotion of fear might be a reaction to the physical restraint and the perceived threat from the other person in the scene.","[362, 9, 692, 401]"
195,HECO_7416.png,Excitement,"The person in the red box appears to be expressing excitement based on the following aspects:

1. **Scene**: The outdoor setting and presence of a large gathering suggest a social event, such as a festival or parade, which typically evokes excitement.

2. **Interactions between people**: The person in the red box is surrounded by other people, with some of them also smiling or expressing joy, indicating a shared positive experience.

3. **Actions and Expressions of the Person in the Red Box**: The person is smiling broadly and appears to be engaging with the surroundings enthusiastically, perhaps waving or gesturing towards someone, consistent with expressions of excitement.

These aspects together convey a scenario where the person is likely excited due to a lively social event and positive interactions with others.","[151, 219, 502, 1015]"
196,HECO_0393.png,Anger,"The emotion of anger expressed by the person in the red box can be analyzed based on the following aspects:

1. **Expressions of the Person (in the red box)**:
   - The person is showing facial expressions typically associated with anger, such as a furrowed brow, gritted teeth, and a tense facial expression. 
   - Their body language is tense, with tightly closed fists and possibly a hunched posture, indicating agitation.

2. **Scene**:
   - The outdoor setting itself might not directly indicate the cause of anger, but surrounding environment details can sometimes contribute to understanding the context. In this case, there isn't a clear scene of conflict, but it does suggest a casual, possibly relaxing setting.

3. **Interactions between People**:
   - There are no other people visible in the context provided by this photo, making it difficult to assess interactions that might fuel the emotion of anger. Hence, interpersonal conflict is not visually evident.

Based on the visible aspects, the primary reason for the person's expression of anger appears to be associated with their facial expressions and body language.","[44, 199, 731, 1000]"
197,HECO_3434.png,Happiness,"The person in the red box is expressing happiness, which can be analyzed from the following aspects:

1. **Scene**: The environment appears to be an outdoor, well-decorated, and pleasant social setting, which often fosters positive emotions like happiness.

2. **Interactions Between People**: The person in the red box is surrounded by people who seem to be engaged in friendly conversations and activities, indicating a social gathering or casual meeting that can contribute to feelings of happiness.

3. **Actions and Expressions of the Person in the Red Box**: Although the specific facial expression of the person cannot be discerned due to the angle, their body language, such as standing or engaging actively in the conversation, suggests a relaxed and joyful demeanor.

These aspects together create an atmosphere conducive to happiness, justifying the person's emotional expression.","[488, 359, 574, 667]"
198,HECO_0207.png,Sadness,"**Analysis of Emotion (Sadness) in the Person in Red Box:**

- **Expressions and Actions of the Person in the Red Box:**
  - The person's facial expression appears neutral or serious rather than reflecting an active display of joy or excitement.
  - The body language is also composed and restrained, suggesting an absence of positive interaction or engagement which might be consistent with sadness.
  - The overall demeanor (posture, lack of smile, focused gaze) implies a more solemn disposition.

**Conclusion:**
The mood of sadness may be inferred from the subtle yet notable facial and bodily expressions that do not exhibit signs of happiness or excitement. The individual's serious demeanor aligns well with the designated emotion of sadness.","[199, 142, 748, 646]"
199,HECO_7069.png,Happiness,"The person in the red box is labeled as expressing happiness. Several aspects convey this emotional information:

1. **Expressions of the person in the red box**: The individual is smiling, which is a clear sign of happiness.

2. **Scene**: The person is positioned behind what appears to be a service desk or counter, possibly indicating they are in a professional setting. The individual seems content and at ease in this environment.

3. **Interactions between people**: While the person in the box is interacting with another person across the counter, the other individual's neutral expression contrasts with the happiness shown by the person in the red box. The positive emotion could be due to the joy of helping someone, completing a task successfully, or a positive interaction with the person they are addressing.","[29, 127, 275, 427]"
200,HECO_8079.png,Happiness,"The person in the red box is expressing happiness. This can be inferred from:

1. **Expression**: The person has a broad smile, which is a common indicator of happiness.
2. **Action**: The person is holding a camera and seems to be taking a selfie, an activity often associated with enjoyment and positive emotion.
3. **Pose**: The person's posture appears relaxed and confident, further suggestive of a happy and content state.

These aspects collectively convey that the person is experiencing happiness.","[12, 74, 926, 964]"
201,HECO_4736.png,Peace,"The person in the red box is expressing the emotion of peace, which can be inferred from the following aspects:

1. **Facial Expression**: The person in the red box appears to have a calm and composed facial expression, which typically is associated with a sense of peace.

2. **Body Language**: The person's body language seems relaxed. Their posture is upright but not tense, suggesting they are comfortable and at ease.

3. **Scene and Interaction**: The surrounding scene appears to be a public setting, possibly a performance or a busy nightclub, suggested by the attire of the woman and the presence of multiple people. Despite the potentially chaotic environment, the person in the red box remains serene, indicating an internal state of peace that is unaffected by external surroundings.

The calm demeanor and the composed body language amidst a vibrant or hectic atmosphere contribute to interpreting the emotion of peace.","[501, 20, 656, 576]"
202,HECO_5259.png,Peace,"In the given image, the person in the red box is labeled as expressing ""Peace."" Several aspects that convey this emotion are:

1. **Expressions and Posture**: The person is showing a calm and neutral facial expression which suggests a peaceful state of mind. Additionally, the person's posture is relaxed, further reinforcing the sense of peace.

2. **Scene**: The environment appears to be an indoor, possibly a personal or public space free of chaos or noise, contributing to the peaceful ambiance.

Together, these elements likely contribute to the person's expression of peace.","[92, 72, 191, 215]"
203,HECO_3640.png,Happiness,"The person in the red box appears to be expressing happiness. Several aspects convey this emotion:

1. **Facial Expression**: The person's facial expression, including a gentle smile, is indicative of happiness.
2. **Scene**: The individual is in a social setting with others, which often contributes to positive emotions.
3. **Interactions Between People**: The presence of others and possible social interactions could enhance feelings of joy and contentment.

Together, these aspects suggest that social context and positive interactions play a significant role in the person's happy emotional state.","[228, 45, 458, 286]"
204,HECO_5666.png,Anger,"In this image, the person in the red box is labeled with the emotion ""Anger."" Here are a few possible reasons for this expression based on visible aspects:

1. **Facial Expression**: The person's eyebrows are furrowed, and their lips are pressed together. These are common indicators of anger.

2. **Body Language**: The person's overall posture appears tense, which can also be associated with anger.

The scene and interactions with other people are not clear in this image, so the analysis focuses on facial expressions and body language.","[194, 33, 613, 563]"
205,HECO_7097.png,Peace,"The person in the red box is showing an emotion of peace. Here's an analysis of why they might be expressing this emotion:

1. **Facial Expression**: The person's facial expression is calm and relaxed. There are no visible signs of stress, anxiety, or tension.

2. **Body Posture**: The posture is upright but relaxed, without any signs of defensiveness or agitation.

3. **Scene**: The background and context of the image appear peaceful and not chaotic, contributing to the overall sense of calm.

4. **Interactions**: The other person in the image is looking at the person in the red box with a neutral or gentle expression, suggesting a positive or neutral interaction which can contribute to a sense of peace for the person in the red box. There is no visible confrontation or conflict in the scene.

By combining these aspects, one can infer that the person in the red box feels peaceful due to their relaxed demeanor, the calm environment, and the non-confrontational interaction with the other individual.","[67, 102, 476, 609]"
206,HECO_0978.png,Happiness,"The person in the red box is expressing happiness, which can be inferred from several aspects of the image:

1. **Facial Expressions:** The individual in the red box has a broad smile, which is a clear indicator of happiness.
   
2. **Interactions Between People:** The person in the red box is interacting with another individual who is also smiling and engaged in a friendly gesture or conversation, suggesting a positive and joyful interaction between them.

3. **Scene and Context:** The setting appears to be a social or formal event where people typically experience and express positive emotions, contributing to the person's happy demeanor. 

These aspects combined provide a comprehensive understanding of why the person is expressing happiness in the image.","[208, 118, 324, 338]"
207,HECO_8090.png,Disgust,"Based on the emotion label ""Disgust,"" let's analyze the image:

1. **Actions and Expressions of the Person in the Red Box**:
   - **Facial Expression**: The person's mouth and eyes might convey disgust (e.g., eyes narrowed, nose wrinkled, lips curled).
   - **Body Language**: The person's posture or gestures (e.g., pulling away from the object they are holding) suggest aversion.

2. **Scene**:
   - **Object in Hand**: The person is holding a teddy bear, which could be seen as unappealing or dirty, causing the disgust reaction.

Combining these aspects, the person's expression of disgust likely results from their interaction with the object they are holding, which they might find unpleasant.","[126, 14, 358, 315]"
208,HECO_7152.png,Sadness,"The person in the red box is expressing sadness, which can be inferred from several aspects in the image:

1. **Facial Expressions**: The person's facial expression is a key indicator. There is an absence of a smile, which is often linked with neutral or negative emotions. The downward cast of the eyes and the somber look contribute to a sad demeanor.

2. **Body Language**: The person's posture is somewhat subdued. They are not appearing engaged or upbeat, adding to the impression of sadness.

3. **Interpersonal Interactions**: The individual appears to be apart from the other person in the scene. There isn't any visible interaction or connection, which may indicate a sense of isolation or disconnection contributing to their sadness.

Based on these observations, the primary aspects conveying the emotion of sadness are the facial expressions, body language, and the apparent lack of interaction with others in the scene.","[18, 44, 445, 671]"
209,HECO_2272.png,Happiness,"The person in the red box is expressing the emotion of happiness, which can be inferred from the following aspects:

**1. Expressions of the person in the red box:**
- The individual is smiling, a clear indication of happiness and positive emotion.

**2. Actions and Posture:**
- The person stands upright with a relaxed posture, often associated with a state of comfort and contentment.

The combination of a smile and relaxed posture strongly conveys an emotion of happiness.","[146, 125, 537, 1018]"
210,HECO_4670.png,Peace,"The emotion of ""Peace"" expressed by the person in the red box can be analyzed through the following aspects:

1. **Scene**:
   - The individual is in a bus, a relatively routine and everyday environment, which might contribute to a sense of normalcy and calm.

2. **Actions and Expressions**:
   - The person appears to have a relaxed posture, sitting down with a composed demeanor.
   - Their facial expression seems neutral to slight contentment, which is consistent with feeling peaceful.

3. **Interactions between People**:
   - There is no sign of conflict or agitation among the people visible in the image. The other passengers are either engaging in conversation or minding their own business, which indicates a calm and non-threatening environment.

Overall, the combination of a routine setting, the individual's relaxed posture, and a calm environment with non-confrontational interactions likely contributes to the person expressing the emotion of peace.","[568, 78, 972, 755]"
